Parameter,Unit,Example,Description
type,-,converter,Category inverter for batteries
CAPEX\_lin,€/kW,200,Specific investment cost per unit of converter power capacity
OEM\_lin,€/kW/y,2,Specific annual O&M cost linked to installed converter capacity
lifetime\_y,years,10,Component lifetime
eta,-,1.0,Round-trip efficiency of the converter
max\_dch,-,1.0,Maximum discharge rate relative to converter capacity
min\_ch,-,0.1,Minimum charge rate relative to converter capacity
max\_capacity,kW,60,Maximum converter power capacity
corr\_asset,str,batt,Name of the corresponding battery asset
